{
  "schema_version": 1,
  "case_id": "eval-001",
  "case_name": "translate-marker-east-6m",
  "skill": "cesiumjs-entities",
  "source": "synthetic-fixture",
  "expected_result": "pass",
  "before": {
    "entities": {
      "marker": {
        "position_ecef": [1333000.0, -4654000.0, 4138000.0],
        "position_cartographic": {
          "longitude_deg": -73.985,
          "latitude_deg": 40.758,
          "altitude_m": 0
        }
      }
    }
  },
  "after": {
    "entities": {
      "marker": {
        "position_ecef": [1333005.7671370078, -4653998.344665975, 4138000.0]
      }
    }
  }
}
